{
  "id": "F-1",
  "severity": "blocking",
  "category": "correctness",
  "file": "src/orders/list.ts",
  "line": 42,
  "title": "Cursor skips the last item",
  "failure_scenario": "With exactly `limit` items the next cursor points past the end, so clients never see the final page.",
  "fix": "Compare with `>=` when computing hasMore.",
  "confidence": 85
}
